{
  "id": "epbs",
  "version": "1.0-draft",
  "canonical_term": "enshrined proposer-builder separation (ePBS)",
  "classification": "core",
  "status": "implementation-facing",
  "type": "primitive",
  "summary": "Protocol-level primitive separating block construction from proposal while preserving an enshrined coordination interface, now backed by public Glamsterdam testnet and devnet implementation evidence.",
  "pipeline_position": [
    "builder coordination",
    "inclusion"
  ],
  "coordination_role": [
    "separates block construction from proposal",
    "defines signed builder-bid, proposer-selection, payload-reveal, and payload-timeliness coordination"
  ],
  "protocol_grounding": [
    "EIP-7732 (Review)",
    "EIP-7773 Glamsterdam inclusion state",
    "EIP-8282 builder execution requests",
    "Ethereum consensus specifications",
    "Platåberget public Glamsterdam testnet",
    "Glamsterdam devnet-9"
  ],
  "naming": {
    "ens": "epbs.eth",
    "canonical": "enshrined proposer-builder separation (ePBS)",
    "mismatch": false,
    "notes": "The ENS label directly matches the canonical ePBS abbreviation."
  },
  "sources": [
    "https://eips.ethereum.org/EIPS/eip-7732",
    "https://eips.ethereum.org/EIPS/eip-7773",
    "https://eips.ethereum.org/EIPS/eip-8282",
    "https://github.com/ethereum/consensus-specs",
    "https://blog.ethereum.org/2026/08/17/plataberget-testnet",
    "https://notes.ethereum.org/@ethpandaops/glamsterdam-devnet-9"
  ]
}
